Name,Notes,Attachments,Consecutive,Locality NAME,Locality Type,GPS COORDINATES,LOCATION NAME,Geo Shape,Protest Location,DESCRIPTION OF PROTEST,Primary SOURCE,Additional Sources,Other Notes,Social Media,Event Type,Actors Involved,Number of Actors,Characteristics,Organization,Part of movement?,Related Events?,Causes,Targets,Data Found From,Unique Key,LAT,LONG,Evernote
Ethiopia,10/25/2017,1 day ,Consecutive,Adama,Major urban area,,Adama Science and Technology University ,Point,College or University,"Students protest the TPLF system, and affirm their commitment to ethnic unity",https://ecadforum.com/2017/10/25/ethiopia-united-adama-university-students-protest/,https://youtu.be/h18gUejDYrU,"TPLF stands for Tigrayan People's Liberation Front, which holds majority of the seats in Ethiopian legislature",,Protest or demonstration,Student,,,,NO,,Government policy,"Anti,Federal government",Manual Google,Ethiopia-8,8.5590847,39.2856442,checked
Ethiopia,4/18/2001,1-2 weeks ,Consecutive,Addis Ababa,Capital City (state or federal),,Addis Ababa University ,Point,College or University,"Students boycotted classes to demand the withdrawal of special forces from their campus, and the restoration of the student. They then organized a march, in which 41 students were killed and 250 injured",https://www.wsws.org/en/articles/2001/04/ethi-a27.html,,,,"Protest or demonstration,Boycott",Student,">1,000","Death occurred,Student Injury,""Non-lethal repression (e.g., tear gas)""",Organized,NO,,"""School quality (food, water, electricity)""","Anti,School authority",Manual Google,Ethiopia-2,9.0468258,38.7590692,checked
Ethiopia,12/21/2005,1 day ,Consecutive,Addis Ababa,Capital City (state or federal),,Addis Ababa University ,Point,College or University,Students protested against the arrest of opposition leaders.,http://www.lexisnexis.com/lnacui2api/results/docview/docview.do?docLinkInd=true&risb=21_T27716718699&format=GNBFI&sort=RELEVANCE&startDocNo=476&resultsUrlKey=29_T27716720603&cisb=22_T27716720602&treeMax=true&treeWidth=0&csi=10962&docNo=483,,,Screen Shot 2018-07-12 at 5.05.02 PM.png (https://dl.airtable.com/NJsFO8eWQeWawyx1xQ1k_Screen%20Shot%202018-07-12%20at%205.05.02%20PM.png),Protest or demonstration,Student,,,,NO,,Solidarity protest,"Anti,Federal government",Lexis Nexis ,Ethiopia-23,9.0468258,38.7590692,checked
Ethiopia,1/3/2013,1 day ,Consecutive,Addis Ababa,Capital City (state or federal),,Addis Ababa University ,Point,College or University,Students are involved in ethnic based clashes on campus,http://www.lexisnexis.com/lnacui2api/results/docview/docview.do?docLinkInd=true&risb=21_T27716718699&format=GNBFI&sort=RELEVANCE&startDocNo=101&resultsUrlKey=29_T27716720603&cisb=22_T27716720602&treeMax=true&treeWidth=0&csi=10962&docNo=121,,,Screen Shot 2018-07-12 at 4.16.37 PM.png (https://dl.airtable.com/20ACoyWVRieHbMssVwMX_Screen%20Shot%202018-07-12%20at%204.16.37%20PM.png),Riot,Student,,"Student Injury,Student violence",,NO,,Ethnic issues,,Lexis Nexis ,Ethiopia-18,9.0468258,38.7590692,checked
Ethiopia,4/24/2015,1 day ,Consecutive,Addis Ababa,Capital City (state or federal),,Addis Ababa University ,Point,College or University,Student protesters accuse the government of not giving enough attention to the plight of Ethiopians in Egypt ,http://www.lexisnexis.com/lnacui2api/results/docview/docview.do?docLinkInd=true&risb=21_T27716718699&format=GNBFI&sort=RELEVANCE&startDocNo=176&resultsUrlKey=29_T27716720603&cisb=22_T27716720602&treeMax=true&treeWidth=0&csi=10962&docNo=189,,,Screen Shot 2018-07-12 at 4.07.38 PM.png (https://dl.airtable.com/3x1MUCiaQneHsJu7MqAL_Screen%20Shot%202018-07-12%20at%204.07.38%20PM.png),Protest or demonstration,Student,"501-1,000",Student arrest,,NO,,Government policy,"Anti,Federal government",Lexis Nexis ,Ethiopia-17,9.0468258,38.7590692,checked
Ethiopia,4/25/2014,1-2 weeks ,Consecutive,Ambo,Town,,Ambo University ,Point,College or University,Students protest the Addis Ababa expansion plan ,https://www.bbc.com/news/world-africa-27251331,,,,Protest or demonstration,Student,,Death occurred,,NO,,Government policy,"Anti,Federal government",Manual Google,Ethiopia-10,8.9823158,37.8448319,checked
Ethiopia,4/26/2018,4 days,Consecutive,Ambo ,Town,,Ambo University ,Point,College or University,Students protest to demand the release of detained students. They were released following the protests ,http://www.africanews.com/2018/04/26/peaceful-protests-in-ethiopia-varsity-leads-to-release-of-detained-students//,,,,Protest or demonstration,Student,,"""Non-lethal repression (e.g., tear gas)""",,NO,,Solidarity protest,"Anti,Security forces",Manual Google,Ethiopia-9,8.9823158,37.8448319,checked
Ethiopia,5/11/2012,1 day ,Consecutive,Amhara,Region,,Bahir Dar University and Gonder University,Point,College or University,"Students protest for their rights, following the arrest of students in Debre Markos University,",http://www.lexisnexis.com/lnacui2api/results/docview/docview.do?docLinkInd=true&risb=21_T27716718699&format=GNBFI&sort=RELEVANCE&startDocNo=276&resultsUrlKey=29_T27716720603&cisb=22_T27716720602&treeMax=true&treeWidth=0&csi=10962&docNo=281,,,Screen Shot 2018-07-12 at 3.55.02 PM.png (https://dl.airtable.com/RmgoxiEJRyKI1PmgjjVQ_Screen%20Shot%202018-07-12%20at%203.55.02%20PM.png),Protest or demonstration,Student,,"""Non-lethal repression (e.g., tear gas)"",Student Injury,Student arrest",,NO,,Solidarity protest,"Anti,Security forces",Lexis Nexis ,Ethiopia-14,11.5872543,37.3957014,checked
Ethiopia,11/30/2015,1 day ,Consecutive,Oromia,Region,,Haramaya University,Point,College or University,"Students protested the integrated development of Addis Ababa and the surrounding Oromia towns, and demanded the release of those detained in protests in other Oromia towns ",https://hornaffairs.com/2015/12/02/ethiopia-university-students-injured-protests-rock-oromia-region/,,,,Protest or demonstration,Student,,"""Non-lethal repression (e.g., tear gas)"",Death occurred",,NO,,Government policy,"Anti,Federal government",Manual Google,Ethiopia-4,9.4082912,42.0345312,checked
Ethiopia,11/28/2017,1 day ,Consecutive,Oromia,Region,,Haramaya University,Point,College or University,Students protest to demand the abolishment of the 'peace forum' which was essentially a spy network for the school authorities ,https://ethsat.com/2017/11/ethiopia-thousands-university-students-left-campus-protest-continues/,,,,Protest or demonstration,Student,">1,000",,,NO,,Other school policies,"Anti,Federal government",Manual Google,Ethiopia-7,9.4082912,42.0345312,checked
Ethiopia,4/4/2018,1-2 weeks ,Consecutive,Oromia,Region,,Haramaya University,Point,College or University,"Students boycott classes to demand the release of detained students. The university closed the cafeteria in a bid to stop the boycott, leading students to nearby communities to find food ",http://addisstandard.com/news-students-of-haramaya-university-say-they-are-forced-to-leave-campus-in-search-of-food/,,,,Boycott,Student,,"""Non-lethal repression (e.g., tear gas)""",,NO,,Solidarity protest,"Anti,School authority",Manual Google,Ethiopia-5,9.4082912,42.0345312,checked
Ethiopia,4/22/2014,1 day ,Consecutive,Oromia,Region,,Jimma University,Point,College or University,Students protested the proposed expansion of the Addis Ababa landmass to include parts of Oromia,http://oromopress.blogspot.com/2014/04/student-protests-against-addis-ababa.html,,,,Protest or demonstration,Student,,"""Non-lethal repression (e.g., tear gas)"",Student Injury,Student arrest",,NO,,Government policy,"Anti,Federal government",Manual Google,Ethiopia-3,7.6820055,36.8559734,checked
Ethiopia,1/13/2016,1 day ,Consecutive,Jimma,Major urban area,,Jimma University ,Point,College or University,Students protested the Addis Ababa expansion plan ,https://blogg.mittmedia.se/habtamu/2016/01/13/over-30-protesting-jimma-university-students-injured-in-bomb-attack/,,,,Protest or demonstration,Student,,"""Non-lethal repression (e.g., tear gas)""",,NO,,Government policy,"Anti,Federal government",Manual Google,Ethiopia-12,7.6820055,36.8559734,checked
Ethiopia,2/24/2006,1 day ,Consecutive,Addis Ababa,Capital City (state or federal),,Menelik and Zerfeshiwal high schools,Point,Secondary School,"Students protested the atrocities committed by the Males regime, and demanded the release of political prisoners",http://www.lexisnexis.com/lnacui2api/results/docview/docview.do?docLinkInd=true&risb=21_T27716718699&format=GNBFI&sort=RELEVANCE&startDocNo=376&resultsUrlKey=29_T27716720603&cisb=22_T27716720602&treeMax=true&treeWidth=0&csi=10962&docNo=387,,,Screen Shot 2018-07-12 at 4.55.18 PM.png (https://dl.airtable.com/eWRr9v7kSOW45Jxjakzz_Screen%20Shot%202018-07-12%20at%204.55.18%20PM.png),Protest or demonstration,Student,,"""Non-lethal repression (e.g., tear gas)""",,NO,,"Solidarity protest,Government policy","Anti,Federal government",Lexis Nexis ,Ethiopia-22,9.0351566,38.7634966,checked
Gabon,11/27/2013,1 day ,Consecutive,,Nationwide,"0.418419, 9.469654",Liberville,Polygon,Public Space,"Teachers protest non payment of allowances, and students protest in solidarity. The government shut down schools in hopes of containing protests",https://www.news24.com/Africa/News/Teachers-hit-out-at-Gabon-government-20131127,,"The beginning date of the strike was not listed, neither was the duration, ",,"Strike,Protest or demonstration","Student,Teachers or Academic Staff",,,,NO,2,"Lecturers' pay,Solidarity protest","Anti,Federal government",Manual Google,Gabon-6,-0.803689,11.609444,checked
Gabon,1/6/2016,1 day ,Consecutive,,Nationwide,"0.418419, 9.469654",Liberville,Polygon,"Primary School,Secondary School",Teachers went on strike  to demand payment of allowances and bonuses from 2014 and 2015,http://www.africanews.com/2016/01/06/teachers-in-gabon-begin-one-month-strike/,,,,Strike,Teachers or Academic Staff,,,Full Participation,NO,6,Lecturers' pay,"Anti,Federal government",Manual Google,Gabon-2,-0.803689,11.609444,checked
Gabon,12/15/2016,3-6 months,Non-consecutive,,Nationwide,"0.418419, 9.469654",Liberville,Polygon,Public Space,Gabonese teachers strike to demand better working conditions ,http://www.africanews.com/2017/03/15/gabon-teachers-seek-solution-to-crisis//,,,,Strike,Teachers or Academic Staff,,,,NO,,,"Anti,Federal government",Manual Google,Gabon-5,-0.803689,11.609444,checked
Gabon,3/12/2012,1-3 months,Consecutive,Liberville,Capital City (state or federal),,Omar Bongo University ,Point,College or University,"Students protested non payment of scholarship funds, and demanded changes to the scholarship disbursement policy, including ending the upper age limit of 27 on eligibility for a scholarship ",http://country.eiu.com/article.aspx?articleid=929133877&Country=Gabon&topic=Politics&subtopic=Rec_5,http://observers.france24.com/en/20120614-leaked-photos-student-protesters-locked-tiny-dark-cell-gabon-libreville-omar-bongo-university-police-video,"The article states that the strike began in March, and protests occurred in April and May, however, the duration of the strike is not clear ",,"Strike,Protest or demonstration",Student,,"""Non-lethal repression (e.g., tear gas)"",Student arrest",,NO,"4, 7",Government policy,"Anti,Federal government",Manual Google,Gabon-1,0.4216609,9.4456136,checked
Gabon,6/3/2013,1-3 months,Non-consecutive,Liberville,Capital City (state or federal),,Omar Bongo University ,Point,College or University,"Students protest non payment of allowances, and university conditions, by gathering every monday on the university campus to air their grievances. ",http://observers.france24.com/en/20130306-students-protest-university-gabon-bongo,,"Date is either June 3rd or March 6th...
This is a continuation of the 2012 protests ",,Protest or demonstration,Student,101-500,,,NO,"1, 7","""School quality (food, water, electricity)""","Anti,School authority,Federal government",Manual Google,Gabon-4,0.4216609,9.4456136,checked
Gabon,2/15/2016,1 day ,Consecutive,,,,Omar Bongo University ,Point,College or University,Students renewed protest for increased allowances ,http://country.eiu.com/article.aspx?articleid=1193971303&Country=Gabon&topic=Politics&subtopic=Forecast&subsubtopic=Political+stability&u=1&pid=466901830&oid=466901830&uid=1,,,,Protest or demonstration,Student,,,,NO,"1, 4",Government policy,"Anti,Federal government",Manual Google,Gabon-7,0.4216609,9.4456136,checked
Gabon,10/26/2017,1 day ,Consecutive,Liberville,Capital City (state or federal),,"University of Science and Health, Owando",Point,College or University,"Students protested an increase in tuition across all public schools in Gabon, as well as to demand better school conditions",http://grandmagafrique.com/en/2017/10/26/gabon-affrontements-entre-policiers-et-etudiants/,,,,Protest or demonstration,Student,,"""Non-lethal repression (e.g., tear gas)""",,NO,,"School fees,""School quality (food, water, electricity)""","Anti,School authority,Federal government",Manual Google,Gabon-3,-0.4829632,15.8936224,checked
Gambia,4/10/2000,1 day ,,Brikama,Major urban area,"13.457441, -16.663813",Gambia Technical Training Institute,Point,Public Space,"Students of the Gambia Student Union protest the rape of a 13 year old girl, by a soldier   and the death of a student at the hands of firemen after the government denied their protest request. The police fired live ammunition at them and killed 14 students ",https://libcom.org/library/gambia-student-massacre-april-10th-2000,https://www.independent.co.uk/news/world/africa/gambian-police-open-fire-on-student-demonstration-282095.html,"It seems like the massacre discouraged students from participating in further protests between the 2000 and the end of President Jammeh's term. People were also required to submit protest requests, which may explain why there is very little information on protests in Gambia ",,"Protest or demonstration,Road block",Student,,"Death occurred,""Non-lethal repression (e.g., tear gas)""",,NO,,Solidarity protest,"Anti,Federal government",Manual Google,Gambia-2,13.2747943,-16.6409198,checked
Gambia,3/25/2015,1 day ,,Sere Kunda,Major urban area,,University of Gambia,Point,College or University,Students protest the grading system and tuition increase,http://foroyaa.gm/utg-students-protest-against-grading-system-tuition-fees-increment/,,,,"Protest or demonstration,Boycott",Student,,,,NO,,"School fees,Other school policies","Anti,School authority",Manual Google,Gambia-1,13.4602792,-16.6766543,checked
Ghana,1/18/2016,1 day ,Consecutive,Accra,Nationwide,"5.6037° N, 0.1870° W",Teachers’ and Education Workers’ Union (TEWU),Polygon,Public Space,The Union of Teachers and Educational Staff strike to demand that the government keeps it promise of increasing salaries of academic staff of higher institutions,http://www.africanews.com/2016/01/18/teachers-union-in-ghana-strike-over-salary-discrepancies/,,,1024x576_321615.jpg (https://dl.airtable.com/g8dUXhc3QpO4cfbMV4n4_1024x576_321615.jpg),Strike,Teachers or Academic Staff,">1,000",,Full Participation,NO,,Lecturers' Pay,"Anti,Federal government",Manual Google,Ghana-2,7.946527,-1.023194,checked
Ghana,9/5/2017,1 day ,Consecutive,,Nationwide,"6.674934, -1.564749",Ghana National Union of Technical Students (GNUTS),Polygon,Public Space,The Ghana National Union of Technical Students (GNUTS) has declared a nationwide boycott of lectures in all technical universities and polytechnics to protest government’s failure to constitute governing councils for the various Technical Universities,http://citifmonline.com/2017/09/05/technical-students-union-declares-nationwide-boycott-of-lectures/,,,,Strike,Teachers or Academic Staff,">1,000",,Organized,NO,,Other,"Anti,School authority",Manual Google,Ghana-6,7.946527,-1.023194,checked
Ghana,3/26/2018,7 days ,Consecutive,,Nationwide,"6.674934, -1.564749",Ghana National Union of Technical Students (GNUTS),Polygon,Public Space,The National Union of Ghana students embarked on a 'red week strike' to protest the US-Ghana military deal.,https://starrfmonline.com/2018/03/26/nugs-hit-street-ghana-us-defence-deal/,http://ghananewsonline.com.gh/nugs-whips-students-in-line-for-massive-demo/,"NUGS later released a statement dissociating themselves from the demonstrations, and called on the police to arrest protesters. It is unclear whether demonstrators were members of factions of NUGS or whether they were independent actors acting under the NUGS umbrella",,"Protest or demonstration,March",Student,">1,000",,Organized,NO,,Government policy,"Anti,Federal government",Manual Google,Ghana-9,7.946527,-1.023194,checked
Ghana,5/17/2014,1 day ,Consecutive,,Nationwide,"6.674934, -1.564749",Ghana National Union of Technical Students (GNUTS),Polygon,Public Space,Students demonstrate the government's decision to remove subsidies for public universities ,http://choicism.com/news/src-s-in-ghana-and-nugs-to-hit-a-nationwide-demonstration/,,,,Protest or demonstration,Student,,,Organized,NO,,Other,"Anti,School authority",Manual Google,Ghana-13,7.946527,-1.023194,checked
Ghana,3/1/2018,1 day ,Consecutive,,Nationwide,"5.560388, -0.198149",National Labor Commission,Polygon,Government Property,"The Technical University Teachers Association of Ghana embarked on a strike to protest the planned amendment of Act 922. grant power to the National Council for Technical Education to perform functions which generally fall within the purview of the Governing Councils, the Academic Boards and the Principal Officers of Universities in Ghana.",https://www.ghanaweb.com/GhanaHomePage/NewsArchive/NLC-meets-striking-Technical-University-Teachers-632470,http://citifmonline.com/2018/03/01/tutag-to-strike-over-ntces-attempt-to-undermine-technical-universities/,,,Strike,Teachers or Academic Staff,,,Organized,NO,,Government policy,"Anti,Federal government",Manual Google,Ghana-26,7.946527,-1.023194,checked
Ghana,9/18/2017,1 day ,Consecutive,,Nationwide,"5.6037° N, 0.1870° W",University Teachers Association of Ghana,Polygon,Public Space,University Teachers Association of Ghana embarked on a solidarity strike with lecturers of the University of Education Winneba. However it was called off after 12 hours,http://citifmonline.com/2017/09/18/utag-suspends-ineffective-strike-over-uew-saga/,,,,Strike,Teachers or Academic Staff,">1,000",,Organized,NO,,Solidarity protest,Anti,Manual Google,Ghana-30,7.946527,-1.023194,checked
Ghana,11/16/2017,1 day ,Consecutive,,Nationwide,"6.710423, -1.627799",Wesley College of Education (WESCO),Polygon,College or University,"Teachers of all 38 colleges of education in the country embarked on a strike to demand payment of arrears dating back to 2012, when the schools were elevated to tertiary education status",https://www.todaygh.com/colleges-education-deserted-following-strike/,,,,Strike,Teachers or Academic Staff,,,Full Participation,NO,,Lecturers' Pay,"Anti,Federal government",Manual Google,Ghana-32,7.946527,-1.023194,checked
Ghana,5/15/2017,1 day ,Consecutive,,Nationwide,"5.6037° N, 0.1870° W",Accra,Polygon,Public Space,Newly recruited teachers from the country's Colleges of Education strike in demand of payment of outstanding arrears,http://www.pulse.com.gh/communities/student/industrial-action-newly-recruited-teachers-threaten-nationwide-strike-over-salary-arrears-id6678367.html,,,,Strike,Teachers or Academic Staff,,,,NO,,Lecturers' Pay,"Anti,Federal government",Manual Google,Ghana-42,7.946527,-1.023194,checked
Ghana,3/2/2018,1 day ,Consecutive,,Nationwide,"5.6037° N, 0.1870° W",Technical University Teachers Association of Ghana (TUTAG) ,Polygon,College or University,"The Technical University Teachers Association of Ghana (TUTAG) embarked on a strike to protest the proposed amendment of 2016 Technical Universities Act, to strip them of autonomy",http://kasapafmonline.com/2018/03/02/technical-university-teachers-association-ghana-begins-strike-today/,,,,Strike,Teachers or Academic Staff,,,,NO,,Government policy,"Anti,Federal government",Manual Google,Ghana-51,7.946527,-1.023194,checked
Ghana,1/22/2018,1 day ,Consecutive,Aboaso,Town,"6°48'21.2""N 1°32'07.5""W",Gyaman Pensan Senior High School ,Point,Secondary School,Students protest school authorities' decision to scrap entertainment events,https://www.myjoyonline.com/news/2018/January-22nd/police-restores-calm-at-shs-in-aboaso-after-riot.php,,,,Riot,Student,,"Student violence,Student suspension,Student Injury",Spontaneous,NO,,Other school policies,"Anti,School authority",Manual Google,Ghana-24,6.8058848,-1.5353893,checked
Ghana,5/28/2018,1 day ,Consecutive,Accra,Federal Capital City ,"5.650684, -0.196801",University of Ghana,Point,Online,Students of the University of Ghana began an online campaign to urge the government to open the University of Ghana Medical Center - this included an online petition ,https://citinewsroom.com/2018/05/28/ghanaians-start-openugmcnow-campaign-on-social-media/,,,"Open-UGMC-now-campaign.jpg (https://dl.airtable.com/Hu8qeoSARSWPYPvSreHV_Open-UGMC-now-campaign.jpg),Guru.jpg (https://dl.airtable.com/hxh4ka48Spq7aLxme6zf_Guru.jpg),OpenUGMCnow-campaign-4.jpg (https://dl.airtable.com/DOjMyrZYR8akBAXs3Z33_OpenUGMCnow-campaign-4.jpg),OpenUGMCnow-campaign-6.jpg (https://dl.airtable.com/0Gzuu8iSNesyj9Iu6ZHk_OpenUGMCnow-campaign-6.jpg),OpenUGMCnow-campaign-7.jpg (https://dl.airtable.com/odnDfSdR1GE825zSOXPP_OpenUGMCnow-campaign-7.jpg),OpenUGMCnow-campaign-5.jpg (https://dl.airtable.com/oPoKGXF6TouQtpWyAPah_OpenUGMCnow-campaign-5.jpg)",Online activism,Student,"501-1,000",Student arrest,,NO,,Other,"Anti,Federal government",Manual Google,Ghana-1,5.6037168,-0.1869644,checked
Ghana,10/9/2017,1 day ,Consecutive,Accra,Federal Capital City ,,University of Professional Studies,Point,College or University,"Students protest the demand the removal of a fuel station situated behind the school, after a gas explosion at a nearby fuel station",http://www.pulse.com.gh/communities/student/protest-upsa-students-demonstrate-against-fuel-station-id7433555.html,,,,Protest or demonstration,Student,101-500,,Organized,NO,,Other,"Anti,School authority",Manual Google,Ghana-3,5.6618605,-0.165504,checked
Ghana,5/18/2017,1 day ,Consecutive,Accra,Federal Capital City ,,Ghana School of Law,Point,College or University,Students boycott examination over mix-up in the questions,https://www.myjoyonline.com/news/2017/may-18th/ghana-school-of-law-students-boycott-exam-over-mix-up.php,,,,Boycott,Student,,,,,,Other,"Anti,School authority",Manual Google,Ghana-5,5.5462279,-0.2054347,checked
Ghana,4/16/2018,1 day ,Consecutive,Accra,Federal Capital City ,, Ghana Technology University College ,Point,College or University,Lecturers strike over unpaid salaries,https://citinewsroom.com/2018/04/16/gtuc-lecturers-strike-frustrates-students-puts-exams-in-doubt/,,,,Strike,Teachers or Academic Staff,,,,,,Lecturers' Pay,"School authority,Anti",Manual Google,Ghana-11,5.5961409,-0.2235428,checked
Ghana,10/13/2017,1 day ,Consecutive,Accra,Federal Capital City ,,Accra Technical University,Point,College or University,Teacher's embark on strike to protest deplorable university conditions,http://citifmonline.com/2017/10/13/accra-technical-university-students-upset-with-lecturers-strike/,,,,Strike,Teachers or Academic Staff,,,,NO,,"""School quality (food, water, electricity)""","Anti,School authority",Manual Google,Ghana-21,5.554086,-0.205594,checked
Ghana,2/21/2018,1 day ,Consecutive,Accra,Federal Capital City ,, GIMPA  law school ,Point,College or University,"Students protest the compulsory long essay requirement for graduating students, which they believe students are ill prepared for",https://starrfmonline.com/2018/02/21/gimpa-law-students-stage-protest-long-essays/,,,,Protest or demonstration,Student,,,,NO,,Other school policies,"Anti,School authority",Manual Google,Ghana-25,5.633809,-0.200238,checked
Ghana,7/24/2017,1 day ,Consecutive,Accra,Federal Capital City ,,University of Ghana,Point,College or University,Students protest high tuition fees,https://www.modernghana.com/news/477223/nugs-protest-unjustifiable-levies-by-university-of-ghana-sch.html,http://www.pulse.com.gh/communities/student/ugfeesmustfall-public-universities-ordered-to-reverse-high-tuition-fees-id7149314.html,https://twitter.com/search?q=ugfeesmustfall&src=typd,,"Media activism,Online activism",Student,,,Organized,YES,,School fees,"Anti,School authority",Manual Google,Ghana-27,5.650562,-0.1962244,checked
Ghana,10/22/2015,1 day ,Consecutive,Accra,Federal Capital City ,,Accra Polytechnic,Point,College or University,Students protest the school's authority to cede utility bills to them if the government does not come to their aid,http://www.pulse.com.gh/communities/student/demonstration-accra-polytechnic-students-agitate-over-utility-tariff-id4285885.html,,,,Protest or demonstration,Student,,,,NO,,"Other,""School quality (food, water, electricity)""","Anti,School authority",Manual Google,Ghana-35,5.554086,-0.205594,checked
Ghana,3/17/2016,1 day ,Consecutive,Accra,Federal Capital City ,,Ghana Technology University College,Point,College or University,Students protest to demand more favorable learning conditions,https://www.pulse.com.gh/communities/student/students-protest-gtuc-students-demonstrate-over-poor-learning-conditions-id4817699.html,,,,Protest or demonstration,Student,,,,NO,,"""School quality (food, water, electricity)""","Anti,School authority",Manual Google,Ghana-36,5.5961409,-0.2235428,checked
Ghana,4/15/2015,1 day ,Consecutive,Accra,Federal Capital City ,,University of Ghana,Point,College or University,Students protest the government meddling in the SRC elections,https://www.myjoyonline.com/news/2015/April-15th/legon-students-protest-govt-interference-in-src-election.php,,,,March,Student,,,,NO,,Other,"Anti,School authority",Manual Google,Ghana-38,5.650562,-0.1962244,checked
